Startup,Type,Intro,Fondateurs,Description,Site,Lien Utile,Info
,,,,,,,
TIIME,Services aux entreprises - Productivité,L'outil indispensable aux entrepreneurs d'aujourd'hui.,['Maxime  Digue'],"['Tiime permet aux entrepreneurs de créer leur entreprise et de simplifier leur comptabilité grâce à des applications mobiles gratuites ultra-intuitives.', 'L’expérience utilisateur proposée par Tiime est inédite, notamment grâce à l’usage avancé de l’Intelligence Artificielle qui permet d’automatiser un maximum de tâches administratives fastidieuses.', 'Tiime a déjà conquis plus de 15 000 entreprises en France.', 'Tiime recherche des personnes impliquées qui souhaitent s’épanouir au sein d’une équipe responsable dans un environnement flexible, bienveillant, et challengeant. Chez Tiime, les collaborateurs sont soudés autour d’un projet à la vision enthousiasmante.', '', 'Ajoutée le : 24 septembre 2019']",tiime.fr,['https://www.linkedin.com/company/tiime-app/'],Société par action simplifiées
MYTIP,Finance - Financement,Le tip en 2 clics accessible à tous,['Maxime DUTRES '],"['Connecte financièrement les créateurs de contenu à leur communauté de façon innovante.', ""MyTip permet aux créateurs de contenu sur Internet d'obtenir un soutien financier de la part de leur communauté."", 'Les créateurs viennent de tous les horizons : YouTubeurs, streamers, gamers, photographes, musiciens, etc.', ""L'application mobile permet à chaque internaute de soutenir un créateur de contenu en 2 clics, soit de façon gratuite en répondant à un sondage,\nsoit en déposant l'argent sur le compte MyTip et en effecutant des dons (à partir de 0.10€)."", '', 'Ajoutée le : 24 septembre 2019']",mytip.co,['https://www.linkedin.com/company/mytip'],Société par action simplifiées
INCEPTO,"Santé, Biotech, Chimie - Health Tech",Solution d’imagerie médicale basée sur l’intelligence artificielle,['Antoine JOMIER '],"['Nous co-créons avec des centres médicaux des applications IA dédiées à la\xa0radiologie.', ""Les professionnels de santé sont maintenant submergés par le volume de patients et d'images, ils ont besoin de nouveaux outils."", ""En tant que garanties de notre système de soins de santé, elles doivent être responsabilisées et participer au processus de production de l'IA."", ""C'est notre mission à travers nos projets de co-création."", '', 'Ajoutée le : 24 septembre 2019']",incepto-medical.com,['https://www.linkedin.com/company/inceptomedical'],Société par action simplifiées
HOPLUNCH,"Restauration, Cuisine, Alimentation - Services",Votre restaurant d'entreprise connecté à Schiltigheim et Strasbourg,['Matthieu DIEBOLD '],"['Vous en avez assez des files d’attente le midi ?\xa0Pas le temps de déjeuner convenablement et sainement ?\xa0', ""Nous avons la solution pour vous : votre nouveau restaurant d'entreprise connecté débarque sur votre lieu de travail !\xa0"", ""Une nouvelle start-up strasbourgeoise répondant au doux nom de HopLunch a fait sa rentrée à l'Espace Européen de l'Entreprise à Schiltigheim.\xa0"", 'Désormais vous pouvez commander votre repas depuis votre poste de travail et éviter le froid, la pluie, la file d’attente, les embouteillages, les accidents… et en profiter pour finaliser votre dossier, faire un peu de sport ou préparer vos vacances…\xa0', 'HopLunch s’occupe de tout concernant votre déjeuner !\xa0\n\xa0\nMais qu’est-ce qu’elle propose exactement...?', 'HopLunch vous permet de commander en ligne les plats du jour fraichement cuisinés par ses partenaires, et d’être livré directement sur votre lieu de travail sans frais additionnels de livraison ni seuil minimum de commande.', '', 'Ajoutée le : 24 septembre 2019']",hoplunch.com,['https://www.linkedin.com/company/hoplunch/about/'],Société par action simplifiées
PRIXPNEUS.FR,Services aux particuliers - Aide à l'achat,Comparateur de prix de pneus,['Magnan Davide'],"['PrixPneus.fr est le nouveau comparateur de prix de pneus.', 'Il a été conçu dans le but de faciliter la vie de millions d’utilisateurs qui achètent des pneus en ligne.', 'En tant que plateforme de référence, PrixPneusfr indexe et compare plus de 200.000 offres de pneus de plus de 10 entreprises de commerce en ligne françaises.', 'Propose un catalogue de plus de 270 marques, à commencer par les plus célèbres marques telles que Bridgestone, Continental, Dunlop, Goodyear, Michelin, Pirelli, Yokohama et bien d’autres.', '', 'Ajoutée le : 24 septembre 2019']",prixpneus.fr/,['https://www.linkedin.com/company/hoplunch/about/'],PRIXPNEUS.FR
SCOOTYPARK,Electronique & Composants - Batteries,Borne connectée de trottinette électrique,"['Timothée DE RIVET ', 'Gabriel MALHERBE ']","['ScootyPark propose des bornes connectées et autonomes de location de trottinettes électriques.', 'La première solution complète de stockage, rechargement, location et emprunt de trottinette électrique véritablement connectée', 'Un service client et un SAV ultra réactif qui vous accompagne tout au long de notre partenariat', 'Améliorez immédiatement le quotidien de vos salariés ou de vos clients grâce à nos différents services', '', 'Ajoutée le : 24 septembre 2019']",scootypark.com,['https://www.linkedin.com/company/scootypark/'],Société par action simplifiées
TRANSWAY,"Cleantech, Energie",Éditeur de solutions intelligentes pour une ville plus propre,['Nicolas TRONCHON '],"['TransWay édite des solutions pour aider à la création des villes intelligentes. Destinés aux réseaux de transport, collectivités, et entreprises, les services de TransWay améliorent la qualité des services urbains tout en réduisant leur coût.\xa0', 'Nos services permettent notamment une exploitation statistique des données issues de nos propres outils, ainsi que des services externes (billettiques, téléphonie mobile, GPS...).\xa0', 'TransWay assure également une assistance dans le domaine de la mobilité et des technologies associées aux transports de personnes.', 'GoToo est une communauté de déplacements et de mise en relation qui récompense les bonnes pratiques en matière de mobilité. Le service est vendu aux entreprises (version Pro), aux villes (version City) et aux réseaux de transports (version Contact).', '| www.feelway.fr : la solution qui transporte vos enfants,\nLa première solution logicielle participative pour faciliter la mise en œuvre des bus pédestres, du Velobus et du co-voiturage Scolaire et extra-scolaire.', '', 'Ajoutée le : 23 septembre 2019']",transway.fr/,['https://www.linkedin.com/company/transway_2/'],Société par action simplifiées
CASHBEE,"Finance - Banque, Assurance",Epargnez plus et mieux,"['Chaker  Nakhli', 'Marc  Tempelman']","['À tous ceux qui pensent que la gestion des finances est une préoccupation. À ceux qui souhaitent faire plus, dans leur vie, et avec leur argent. À ceux qui exigent d’avoir le choix. À ceux qui veulent prendre les bonnes décisions.', 'Cashbee remet l’argent qui dort à votre service.', '1. Une meilleure compréhension de vos finances personnelles: identifier l’argent qui dort et éviter les frais bancaires.', '2. Un moyen simple et efficace de mettre de l’argent de côté, sur un compte d’épargne sécurisé, rémunéré et toujours disponible.', 'Il ne faut pas grand chose. Du bon sens, un peu de savoir faire, et une application.', '', 'Ajoutée le : 23 septembre 2019']",cashbee.fr,['https://www.linkedin.com/company/cashbee/'],Société par action simplifiées
DANITIS,"Emploi, Job",Spécialiste du recrutement et de l’outsourcing dans le secteur de la Distribution IT en France,['Jean-Charles DISTAIN'],"['Nos candidats sont le coeur de notre métier et c’est pourquoi nous défendons une approche avant-gardiste du recrutement et de la gestion des talents.', 'Danitis recrute tous les jours des collaborateurs d’exception dans les domaines commerciaux, marketing, techniques, achats et supports afin de servir les leaders du secteur IT en France et en Europe.', '', 'Ajoutée le : 23 septembre 2019']",danitis.com/,['https://www.linkedin.com/company/danitis/'],SARL
SCINTIL PHOTONICS,"Electronique & Composants - Instrumentation, Capteurs",Une société qui développe des circuits intégrés photoniques en silicium,['Sylvie MENEZO '],"['SCINTIL Photonics est une société sans usine qui développe des circuits intégrés photoniques en silicium.', 'Les solutions SCINTIL combinent le meilleur des matériaux à base de silicium (Si) et de phosphure d’indium (InP) grâce au collage d’InP sur Si à la tranche, et s’appuient sur des procédés de fonderie commerciaux en silicium pour construire des circuits photoniques totalement intégrés (comprenant des lasers à longueurs d’onde multiples, des guides d’ondes, des filtres de longueur d’onde) et photodétecteurs).', '', 'Ajoutée le : 23 septembre 2019']",scintil-photonics.com/,['https://www.linkedin.com/company/scintil-photonics/'],Société par action simplifiées
MATOS BTP,"Immobilier, BTP, Architecture - BTP, Architecture",Application de gestion de l’activité du locatier qui les connecte avec les entreprises de TP,['Frédéric COROLLEUR '],"['Traçabilité\nRemontée automatique et dématérialisée des informations et des documents administratifs liés à la location. (Ordre de mission, bons de location, rapports journalier, passeport conducteur…)', 'Sécurité\nAccédez directement à l’ensemble des documents réglementaires du conducteur et des engins', 'Simplifiez les accueils sécurité et responsabilisez les opérateurs sur le port des EPI', 'Gestion des plannings\nGérez simplement l’organisation de vos locations grâce aux plannings en ligne, partagés et actualisés en temps réel !', '', 'Ajoutée le : 23 septembre 2019']",matosbtp.com,['https://www.linkedin.com/company/matos-tp/'],SA par action simplifiée à associé unique
BARTOC,SSII & NTIC - Big Data,La nouvelle plateforme d'analyse grâce à l'intelligence artificielle,['David  Laleye'],"[""Décryptez des millions d'images partagées sur Instagram.\nGrâce à l' IA segmentez vos audiences, créez du contenu percutant et augmentez votre engagement."", ""Recevez des données organisées et illustrées.\nBartoc vous permet d'extraire les informations contenues sur des millions d'images partagées par les utilisateurs."", ""Segmentez des audiences à partir de leur langage visuel.\nNotre algorithme permet d'identifier des profils types en fonction des éléments apparaisant sur les images.\n\xa0"", '', 'Ajoutée le : 23 septembre 2019']",bartoc.co,['https://www.linkedin.com/company/bartoc'],Ile De France
BYBLOS,Services aux particuliers - Aide à l'achat,Outil simple qui vous permet de trouver facilement les livres qui vous intéressent,['Dara HIZVEREN '],"['Cherchez, trouvez, ajoutez…\nByblos est un outil simple qui vous permet de trouver facilement les livres qui vous intéressent.', 'Une fois trouvés, vous pouvez accéder aux détails, et les ajouter à votre liste pour les consulter plus tard ou les commander.', 'La reconnaissance vocale à votre service\nByblos peut déclencher une recherche en utilisant la puissance de la reconnaissance vocale.', 'Dites à Byblos le titre ou l’auteur du livre que vous cherchez et il vous le trouvera.', 'Des résultats complets en un éclair\nByblos utilise des bases de données qui sont continuellement mises à jour et effectue les recherches ultra rapides pour votre confort d’utilisation.', 'Facile à utiliser\nCommandez chez votre libraire en quelques secondes!', 'Rien de plus simple que de commander les livres qui sont sur votre liste.', 'Sélectionnez les livres et le libraire et c’est tout ! Pas de paiement, pas de livraison : le libraire vous confirme la disponibilité des articles commandés et vous vous rendez chez le libraire pour régler votre commande et chercher vos livres… et qui sait, vous allez peut être en découvrir d’autres une fois sur place…', 'Des idées ? Ecrivez nous…\nNous sommes toujours à l’écoute des amoureux du livre.', 'Vous avez des idées pour améliorer Byblos? Vous rencontrez des problèmes ? Ecrivez-nous et nous ferons tout pour accéder à votre demande le plus rapidement possible.', '', 'Ajoutée le : 23 septembre 2019']",byblosapp.com/,['https://www.linkedin.com/company/zeplin-mobile-solutions/about/'],SA par action simplifiée à associé unique
NEWBIZ CONSULTING,"Services aux entreprises - Marketing, communication",Cabinet de conseil en développement commercial spécialisé dans les métiers de la communication et du marketing,['Pascal CROUZAT '],"['NEWBIZ Consulting est un cabinet de conseil en développement commercial spécialisé dans les métiers de la communication et du marketing,\xa0', ""qui a pour objectif d'accompagner les agences de communication et entreprises du secteur dans l'acquisition de nouveaux business."", ""La vocation de NEWBIZZ Consulting est l'accompagnement du chef d'entreprise, dirigeant de PME et TPE."", 'Le Newbiz au coeur de votre entreprise :Boostez la détection et la mise en œuvre des opportunités de croissance.', ""Détection d'opportunités, transformation en affaires, mise en œuvre de stratégies de croissance, optimisation de votre organisation, \xa0Newbiz Consulting vous accompagne dans le développement de votre entreprise."", '', 'Ajoutée le : 23 septembre 2019']",newbizconsulting.fr,['https://www.linkedin.com/company/newbizconsulting'],Commerçant
GREENPHONE,"Cleantech, Energie - Recyclage",Achetez et vendez vos appareils électroniques usagés pour rendre notre Planète meilleure,['Hadry Gassama'],"[""Vous venez de casser l'écran de votre smartphone. Il est tout fendillé, encore utilisable ou non."", ""Avant de vous rendre chez le réparateur, ou de le jeter ou encore d'en racheter un nouveau, sachez que vous pouvez revendre cet écran cassé à GreenPhone."", 'Conscient des effets néfastes de l’industrie de la téléphonie mobile sur la planète, le recyclage est devenu évident.', 'GreenPhone est né.', 'La mission de GreenPhone est de servir l’humanité et l’environnement, conformément aux convictions de ses deux fondateurs.', 'Nous nous concentrons donc sur le développement durable. Le défi étant d’essayer de transformer les problèmes en solutions. les problèmes environnementaux sont nombreux et la tâche est énorme, mais nous y croyons et faisons tous les efforts possibles pour y arriver.', 'En utilisant les services de GreenPhone vous participez modestement mais surement à la sauvegarde de l’environnement. Pour chaque transaction, nous faisons un don de 1,00 € à une association qui œuvre pour le reboisement en Afrique.', '', 'Ajoutée le : 21 septembre 2019']",green-phone.com/,['https://twitter.com/@Green__Phone'],Société par action simplifiées
POPSI CUBE,"Santé, Biotech, Chimie - Pharmaceutique",Organisme de recherche contractuelle et clinique agile (ORC),['Fabrice BEAUCHENE'],"[""Nous proposons à nos partenaires des secteurs Pharmaceutique, Biotech et Medtech une externalisation complète de leurs essais cliniques en intégrant l'intégralité de la chaîne de création de valeur de l'activité de développement de produits médicaux."", 'Popsi Cube est à l’origine d’une convergence entre un processus clinique solide et des outils informatiques efficaces.', 'Une CRO avec des outils intégrés pour traiter l’ensemble du champ fonctionnel de la recherche clinique.', ""Une gestion de projet réussie nécessite des ressources humaines de qualité supérieure, mais également un ensemble d'outils permettant de prendre des décisions simples, pertinentes et efficaces. Popsi Cube n'a pas trouvé de système sur étagère qui répondrait à ces objectifs. Nous avons donc développé un ensemble d’outils spécifiquement adaptés à nos services."", '', 'Ajoutée le : 20 septembre 2019']",popsicube-fovea.com,['http://fr.linkedin.com/company/popsi-cube'],SARL
LES CEREALES DU GOUT,"Restauration, Cuisine, Alimentation - Biscuits, Sucreries","Des céréales croustillantes bio, aussi saines que gourmandes","['Laury Galarza', 'Antoine Dache']","['Marre des céréales industrielles ultra-transformées et trop sucrées ?', 'Avec Les Céréales du Goût, faites-vous plaisir sans compromis. Idéales pour le petit déjeuner ou les encas de la journée, elles font craquer les enfants comme les plus grands. Fabriquées en France avec des ingrédients issus de l’agriculture biologique, elles sont aussi saines que gourmandes !', '', 'Ajoutée le : 20 septembre 2019']",lescerealesdugout.fr,['https://www.linkedin.com/company/les-cereales-du-gout/'],Artisan (civil)
WAEPASS,"Art, Culture, Loisirs, Sport - Sport",Crée ton Pass multisport à Bordeaux,"['Xavier JAN', 'Florent SANFOURCHE']","['Notre équipe est composée de pratiquants de sports, on peut même parler d’accro aux sports.\nQue ce soit en groupe, avec un ballon, un peu de fonte ou une bonne board, nous sommes sur tous les terrains/spots/salles !!!', 'Comme nous ne sommes pas les seuls à vouloir tout tester, nous avons pensé proposer à chacun de pratiquer n’importe quel sport où il veut et quand il veut, en limitant les conséquences dérangeantes.', 'Voici une liste non exhaustive de ce que tu pourrais faire avec nous :', '', 'Ajoutée le : 20 septembre 2019']",waepass.com,['https://www.linkedin.com/company/your-sports/'],Société par action simplifiées
SATISFIX,Services aux particuliers - Services à domicile,Réparation Électroménager sur Lyon,"['Dorian  Berthier', 'Simon  Besnard']","['Le concept de SATISFIX est né au cours de l’un de ces après-midi pluvieux que l’on passe à refaire le monde devant un café.', 'Il est avant tout l’objet d’une constatation simple : l’urgence de moderniser le secteur de la réparation d’électroménagers et d’y insuffler une dimension économique et écologique.', 'Face à cette problématique, les acolytes décident alors de réunir leurs connaissances, leurs qualités humaines et leurs expériences pour créer une entreprise innovante.', 'Ainsi, SATISFIX allie proximité, fiabilité, réactivité, transparence et professionnalisme en proposant des réparations de petits et gros électroménagers à domicile sur l’ensemble de la région lyonnaise.', 'L’enseigne tend à promouvoir des interventions de haute qualité à des prix clairs et accessibles pour encourager les citoyens à réparer plutôt qu’à surconsommer.', '', 'Ajoutée le : 20 septembre 2019']",satisfix.fr,['https://www.linkedin.com/company/satisfix'],SARL
FOOTBAR,Electronique & Composants - Objets connectés,Objet connecté pour le Football,['Sylvain RACT '],"['Notre premier service est un site internet gratuit : https://footbar.fr/ utilisé par 25 000 licenciés permettant aux joueurs français d’évaluer leurs performances quelque soit leur niveau de jeu et de mesurer leur impact offensif et/ou défensif sur un match.', ""Cependant, notre site ne permettait pas d'évaluer les performances physiques du joueur. Dans le cas du football c’est pourtant essentiel !\xa0"", ""Nous avons développé le Footbar Meteor pour les footballeurs : un tracker d'activité se plaçant derrière le mollet et sous la chaussette du joueur."", ""A l'inverse des bracelets de running, il est compatible avec la pratique du football en compétition et est bien plus précis.\xa0"", ""Il permet d'analyser différentes caractéristiques du joueur comme sa vitesse, ses accélérations, ses déplacements, la distance qu'il a parcouru ..."", 'Nous travaillons actuellement sur une v2 du produit pour offrir aux joueurs encore plus de statistiques comme la puissance de frappe ou encore le rapport du joueur avec le ballon.\xa0', 'Avec Footbar, vous pouvez consulter vos performances et suivre votre évolution mais aussi vous comparer avec des joueurs de championnats différents grâce au site : https://meteor.footbar.com/\xa0', 'Footbar Meteor est le nouveau dénicheur des joueurs talentueux du XXIème siècle.', '', 'Ajoutée le : 20 septembre 2019']",footbar.com/fr/,['https://www.linkedin.com/company/footbar-fr/'],Société par action simplifiées
MY SAAM VISION,Finance - Comptabilité,Logiciel Facturation en ligne,"['Christian HUVER ', 'Serge VITALI ']","['My-Saam Vision est un logiciel de gestion et de facturation en ligne. Simple d’utilisation et abordable, il accompagne les indépendants et les TPE dans l’élaboration des devis, factures et le suivi de la rentabilité.', 'Oubliez vos multiples tableaux Excel. En un coup d’oeil vous avez accès à vos indicateurs clés de performance.\xa0', 'Vous suivez également en temps réel vos indicateurs clés tels que votre chiffre d’affaire, la marge que vous dégagez, les heures facturées et votre résultat prévisionnel. Vous gardez ainsi un œil au quotidien sur vos objectifs à atteindre et ce qui est réalisé à l’instant t.', '', 'Ajoutée le : 20 septembre 2019']",my-saam.com,['https://www.linkedin.com/company/my-saam/'],SARL
SIGNA PUB,"Services aux entreprises - Marketing, communication",Sticker signalétique sur mesure - Pub et décoration,['Alexandre RETAILLEAU'],"[""Stickeramoi\xa0vous\xa0propose des stickers de grande qualité à des prix très abordables.\n\nNotre catalogue s'agrandit chaque mois, mais n'hésitez surtout pas à nous faire part de vos attentes et idées de décoration !"", '', 'Ajoutée le : 20 septembre 2019']",stickeramoi.com/,['https://www.facebook.com/Signa-Pub-TOURS-37-1555516024692384/'],SARL
BEST ITINERARY,"Voyage, Hébergement",Trouvez les meilleurs itinéraires de voyage et simplifiez la préparation de votre voyage,"['Julien PIERRAT', 'Julien  PIERRAT']","['www.best-itinerary.com est une plateforme web (disponible en français et en anglais) répertoriant des centaines d’itinéraires « faits maison » par une équipe de passionnés du voyage.', ""Objectif : regrouper sur une seule et même plateforme toutes les informations nécessaires à l'organisation optimale d’un road-trip."", 'En plus de ce service gratuit, nous proposons un service de ""voyage-de-rêve-sur-mesure"" ultra personnalisé par notre équipe de Travel Planner.', ""Notre équipe accompagne les futurs voyageurs sur la préparation complète de leur trip, de la conception de l'itinéraire à la recherche des meilleurs vols, hébergements, moyens de locomotion, activités... Jusqu'à la fourniture d'un roadbook complet."", ""Le voyageur n'a plus qu'à se laisser porter, valider les propositions et réserver !"", '', 'Ajoutée le : 20 septembre 2019']",best-itinerary.com/,['https://www.linkedin.com/company/14066569/'],Société par action simplifiées
GROOVER,"Art, Culture, Loisirs, Sport - Musique",Fais la Promotion de ta Musique avec Succès,"['Dorian PERRON ', 'Romain PALMIERI']","['Donner le pouvoir auxartistes\xa0de faire découvrir leur musique.', 'Lancé en octobre 2018, Groover met en contact les artistes qui veulent promouvoir leur musique et les meilleurs médias, radios et labels en quête de talents émergents.', 'Une nouvelle plateforme qui garantit surtout aux musiciens d’être écoutés, d’avoir enfin des retours et de gagner en visibilité.', 'Une connexion entre artistes & influenceurs interrompue', 'Plus de 40.000 nouveaux morceaux sortent chaque jour sur Spotify. S’il est devenu beaucoup plus simple de produire et rendre disponible sa musique en ligne, il est d’autant plus compliqué pour un musicien d’émerger de la masse.', 'Pour se faire connaître, les musiciens envoient des centaines de mails à des médias et labels complètement submergés de demandes. Comme une bouteille à la mer, Ils ne reçoivent aujourd’hui aucune réponse.', 'Groover, la solution pour promouvoir sa musique avec succès\nGroover permet de connecter les musiciens ou leurs représentants avec des médias, labels et influenceurs, en leur assurant d’être écoutés, d’obtenir des retours constructifs sur leurs morceaux et gagner en visibilité.', 'Comment ? L’artiste ou son représentant envoie directement un morceau à une sélection de médias, labels, radios de son choix pour 2 Grooviz par contact. Chaque influenceur est rémunéré 1 Grooviz pour l’écouter et écrire un court retour à l’artiste, qu’il décide ou non de partager le morceau.', '', 'Ajoutée le : 20 septembre 2019']",groover.co,['https://www.linkedin.com/company/heygroover'],Société par action simplifiées
MYFORMALITY,"Services aux entreprises - Juridique, Administratif",Conseils et documents juridiques en ligne,['Valérie  Briday'],"['MyFormality est une marketplace permettant à tout entrepreneur d’obtenir un accompagnement personnalisé dans ses démarches administratives juridiques.\xa0', '- Définissez vos critères et besoins directement sur la plateforme grâce à un formulaire\n- MyFormality génère automatiquement les documents nécessaires à vos démarches\n- Recevez un accompagnement personnalisé par des experts connectés en visioconférence\n- Signez vos documents de façon électronique\n\xa0\nVos formalités administratives sont donc réalisées rapidement, 100% en ligne ! \xa0', 'Gagnez du temps. Faites des économies. Profitez de notre expertise.', '', 'Ajoutée le : 19 septembre 2019']",myformality.com/,['https://www.linkedin.com/company/myformality'],Société par action simplifiées
PECHE A LA PRIME,"Finance - Investissement, Trading",L'apport d'affaires ponctuel,['Kevin  ANDRE'],"[""Les avantages pour devenir apporteur d'affaires ponctuel :\nFaites vous rémunérer lorsque vous faites des recommandations."", 'Les avantages pour les entreprises :\nDéveloppez votre business grâce aux apporteurs d’affaires ponctuels\n\xa0', '', 'Ajoutée le : 19 septembre 2019']",palp.fr,['https://www.linkedin.com/company/palp/about'],SARL
