Startup,Type,Intro,Fondateurs,Description,Site,Lien Utile,Info
VICINITY,"Immobilier, BTP, Architecture - Immobilier","Plateforme de communication entre habitants et gestionnaire (Syndic, Résidence étudiante, Bailleur)",['Jérémie MAYOLA '],"[""Vicinity est une plateforme de communication entre habitants d'immeubles et leur syndic de copropriété.\xa0"", ""C'est l'outil idéal pour améliorer la cohésion en copropriété et la communication de la part des syndics de copropriété.\xa0"", ""Aujourd'hui avec Vicinity dans votre immeuble: Une panne d'ascenseur? Un sinistre dans votre logement? Un souci avec les parties communes? Vous ne savez pas à qui vous adresser?\xa0\nNe cherchez plus et contactez directement votre syndic de copropriété, en instantané, depuis votre plateforme mobile!"", ""Vous proposez du soutien scolaire? Vous oubliez votre parapluie dans le hall? Vous cherchez le commerçant le plus proche?\xa0\nÉchangez avec vos voisins sur tout les bons plans, et informations utiles, depuis un espace d'échange commun.\xa0"", 'Vous êtes syndic et vous désirez contacter toute une copropriété en particulier? Vous souhaitez informer un propriétaire ou un locataire?\xa0\nDepuis votre espace de gestion, communiquez à vos habitants toutes les informations qui leur incombent en ayant des réponses réactives!\xa0', ""Alors n'attendez plus, et rejoignez VICINITY!"", '', 'Ajoutée le : 16 septembre 2019']",vicinity-app.com,['https://www.linkedin.com/company/18942963'],Société par action simplifiées
ZOT PHARMA,"Santé, Biotech, Chimie - Pharmaceutique",Application mobile 100% gratuite qui permet à ses utilisateurs de découvrir et essayer des produits de parapharmacie,['Sébastien RIVIERE'],"['ZOT PHARMA est une application mobile 100% gratuite qui permet à ses utilisateurs de découvrir et essayer des produits de parapharmacie tout en bénéficiant d’une réduction après un premier achat.', 'Le principe est simple, votre smartphone en main, vous téléchargez gratuitement l’application ZOT PHARMA disponible sur Apple Store ou Play Store.', 'Vous découvrirez une large gamme de produits de parapharmacie disponible en pharmacie, parapharmacie et vente en ligne. Pour chaque offre en cours, une réduction vous sera proposée sous forme de remboursement après achat.', 'Vous pourrez directement acheter le ou les produits dans la pharmacie ou parapharmacie de votre choix, en demandant à votre pharmacien de vous remettre un ticket de caisse.', 'Aussitôt chez vous, depuis l’application mobile ZOT PHARMA : Photographiez votre ticket de caisse Scannez le code-barres Et hop, vous êtes remboursés de tout ou partie de votre achat directement sur votre compte bancaire ou par PayPal.', 'Alors, n’attendez plus, téléchargez l’application ZOT PHARMA , connectez vous et vous profiterez d’offres exclusives de grandes marques en pharmacie et parapharmacie.', 'De nombreuses grandes marques nous font déjà confiance Vous souhaitez maintenant découvrir et essayer de nouveaux produits de parapharmacie, téléchargez ZOT PHARMA, notre application mobile IOS et Android, 100% gratuite !!!', '', 'Ajoutée le : 16 septembre 2019']",zotpharma.fr,['https://www.linkedin.com/company'],SA par action simplifiée à associé unique
NUKKAI,SSII & NTIC,Un jeu de carte basé sur l'intelligence artificielle,['Véronique VENTOS'],"['Véronique, chercheuse senior à Paris Saclay, a commencé à travailler sur le Bridge en 2015 et a publié plusieurs articles sur le sujet.', 'Ses méthodes ont aidé le programme de ponts WBridge5 à remporter deux fois les Championnats mondiaux de ponts informatiques en 2016 et 2017.', ""Elle et d'autres collègues chercheurs se sont peu à peu convaincus que le pont n'était rien de moins que la prochaine étape importante pour l'intelligence artificielle."", ""Elle a réuni des scientifiques de différentes communautés de l'intelligence artificielle et des experts en passerelles pour lancer le projet international Alphabridge (maintenant appelé idgeBridge) qui s'est développé très rapidement."", '', 'Ajoutée le : 13 septembre 2019']",nukk.ai/,['https://www.linkedin.com/company/nukkailab/'],Société par action simplifiées
SMART-SERVICES,Services aux entreprises - Productivité,"Gérez vos bureaux en toute simplicité, Smart-Services",['Mamoun  Idrissi'],"['A titre privé, vous utilisez de nombreuses applications dans votre quotidien comme Uber pour vous déplacer, Deliveroo pour commander à déjeuner ou Helpling pour votre ménage.', 'Poussez la porte d’une entreprise et vous ferez un bon de 15 ans... en arrière ! Seuls les emails, téléphone et parfois même le fax sont à disposition.', ""C’est en partant de ce postulat que nous avons décidé d’apporter l'innovation qui manquait aux entreprises: une plateforme digitale qui centralise et simplifie la gestion des bureaux."", 'Smart-Services centralise la gestion des services de bureaux dans un seul espace: en 3 clics, on vous trouve les bons prestataires au bon prix et Smart-Services devient votre interlocuteur unique au quotidien.', 'Ça tourne comme une horloge.', 'Notre vision est simple: mettre la technologie à votre disposition pour faciliter la gestion de vos bureaux afin de contribuer au bien-être de vos collaborateurs et garder vos talents!', '', 'Ajoutée le : 13 septembre 2019']",smart-services.com/,['https://www.linkedin.com/company/11102252/'],Société par action simplifiées
ILEK,"Cleantech, Energie",Fournisseur d'électricité verte et de gaz bio issus de producteurs d'énergie indépendants d'origine française,['Julien CHARDON'],"[""Ilek est une startup basée à Toulouse pleine de rêve et d’ambition. Le rêve d’un monde où l’énergie renouvelable constitue la plupart de notre consommation quotidienne et l’ambition d’un fournisseur d’électricité qui changerait les règles du jeu en plaçant le client au centre. ilek est un fournisseur d'électricité verte et de gaz bio issus de producteurs d'énergie français indépendants. Notre modèle : permettre à des producteurs d'énergie renouvelable de vendre directement leur production à des particuliers. Nous mettons en relation producteurs d’énergie renouvelable et consommateurs pour rendre le marché de l'énergie plus simple et transparent. Nous permettons à des foyers de pouvoir changer de contrat de fourniture en bénéficiant pour le même prix d’une énergie verte et locale. L'ensemble de nos équipes sont réunies en plein centre de Toulouse pour un service au plus proche des consommateurs, rapide et efficace. Une équipe jeune et pleine d'ambitions pour renouveler le rapport à l'énergie des ménages français."", '', 'Ajoutée le : 13 septembre 2019']",ilek.fr/,['https://www.linkedin.com/company/ilek/'],Société par action simplifiées
SKEEL,SSII & NTIC - Media,Application mobile de challenges vidéos permettant une compétition virtuelle entre utilisateurs,"['Jonathan CAZENAVE PEYRASSON ', 'Camille PERISSAT ']","['Tu veux savoir qui a fait l’action la plus folle d’un jeux vidéo, le trickshot le plus incroyable, le plus beau freestyle de foot, le slowmotion le plus stylé, etc … ?', 'Alors cette app’ est faite pour toi !', 'Viens te confronter aux autres en postant tes vidéos dans les différents #challenges, accumule des points et des diamants pour monter en grade et accéder aux premières places du Hall of Fame.', 'Tu peux voter sans limites, mais donner seulement 3 diamants par jour aux vidéos que tu trouves les plus incroyables !', 'Il y a des challenges et vidéos pour tous les goûts : sport (freestyle ski, foot, tennis, dance, bmx, skate, roller …), animaux, trickshot, musique, jeux vidéos, bottle flip, paysages, défis écologique, slowmotion, rollback, … Tu l’as compris, tout peut être un challenge !', 'Et si tu ne trouves pas ton bonheur, créer ton challenge et invite tes amis à te répondre pour des battles toujours plus enflammées !!', '', 'Ajoutée le : 13 septembre 2019']",skeelapp.com/,['https://www.linkedin.com/company/skeel/'],Société par action simplifiées
GLEEM,Services aux particuliers - Services à domicile,Lavage Auto À Domicile,['Alexandre COMA '],"[""Vous habitez à Paris ou dans la petite couronne ? Vous n'êtes pas satisfait des options pour laver votre voiture ? Essayer le lavage auto à domicile et profitez de votre temps retrouvé."", 'Fini les voitures sales. Fini l’attente en station de lavage. Fini les crottes de pigeons.', 'Pas de stations de lavage à proximité? N’interrompez plus vos journées chargées et laissez-nous vous simplifier la vie. Commandez un lavage auto en quelques clics.', 'Ne lavez plus jamais votre voiture vous-même. Faire laver sa voiture n’a jamais été aussi simple !', '', 'Ajoutée le : 13 septembre 2019']",gleem.eu,['https://twitter.com/@gleem_Fr'],Société par action simplifiées
HELLOPRET,Finance,Le Prêt Immo 100% Digital,['Olivier JOURDAN '],"['HelloPrêt est né d’un constat simple : trouver le meilleur crédit immobilier c’est pénible ! ;-)', 'Qui a le temps de prendre rendez-vous avec 15 banques et comparez les taux ?\nQui peut prendre une pause de 2 heures dans la journée pour aller rencontrer un courtier ?\nQui a l’expertise pour décortiquer toutes les petites lignes des offres de crédits ?\nQui a envie de tout ça ...?', 'Tous les jours, l’équipe de HelloPrêt se demène pour rendre le crédit le plus fluide possible. De votre toute première simulation à la confirmation de votre crédit bancaire, nous mettons toutes les nouvelles technologies au service de votre prêt immobilier.', '', 'Ajoutée le : 13 septembre 2019']",hellopret.fr/,['https://www.linkedin.com/company/hellopret/'],Société par action simplifiées
NANOCODE,Services aux entreprises - Conseil,Plate-forme collaborative et coopérative de gestion de crise,['Thierry ROLLAND DE RAVEL '],"[""NANOCODE Labs fournit une plateforme collaborative pour automatiser l'alerte et la gestion des situations de crise."", 'Accessible depuis un smartphone, une tablette ou un PC/MAC, la solution EASYLIENCE© renforce la résilience des organisations et optimise le coût des crises.', '', 'Ajoutée le : 13 septembre 2019']",nanocode-labs.com,['https://www.linkedin.com/company/nanocode-labs/'],SA par action simplifiée à associé unique
NEXTPERIENCE,"Services aux entreprises - Management, stratégie","Spécialiste des stratégies de croissance, qu'elles soient internes, externes ou hybrides",['Vincent GRIMALDI '],"[""NEXTPERIENCE est un jeune cabinet dans le domaine de la banque d’affaires, spécialisé dans l'accélération d'entreprises technologiques et innovantes."", ""Nos conseils se concentrent sur les stratégies de croissance, le corporate finance, la fusion et acquisition, et l'animation de tiers-lieux."", 'nous ne marchons pas, nous courrons !', ""NEXTPERIENCE rassemble toutes les compétences en matière de conseil stratégique et de capital investissement pour aider les entreprises innovantes et leurs investisseurs, incubateurs et pépinières d'entreprises."", ""Nous sommes des techies combinant l'expérience de la Chine et des Etats-Unis avec la touche française.\xa0"", 'Yes, we are different !', '', 'Ajoutée le : 13 septembre 2019']",next-perience.com,['https://www.linkedin.com/company/nextperience-tech/about/'],SA par action simplifiée à associé unique
GONG APHASIE,"Santé, Biotech, Chimie - Health Tech",L’application qui rétablit la communication grâce aux images,['Alexandre  Boulmé'],"['J’imagine que vous avez déjà eu un mot « sur le bout de la langue ». Énervant n’est-ce pas ? \xa0C’est le quotidien de 300 000 personnes en France : on appelle cette pathologie « l’aphasie ».\n\xa0\nL’aphasie survient après un AVC : du jour au lendemain, certaines personnes se retrouvent incapables de retrouver les bons mots, coupant leur communication.\xa0\n\xa0\nL’application Gong, conçue par des orthophonistes, rétablit la communication grâce aux images. La personne peut retrouver les mots grâce au clavier d’images personnalisé construit par son orthophoniste. Elle peut l’utiliser ensuite pour se faire comprendre dans sa vie de tous les jours.', '', 'Ajoutée le : 11 septembre 2019']",gong-aphasie.fr,['https://www.linkedin.com/company/samesame-app/'],SARL
SURFY,SSII & NTIC - Big Data,Solution digitale de centralisation des plans et des données en mode SaaS,['Kambiz FAROOGHI '],"[""Agile, pratique et multifonctionnel Surfy vous aide au quotidien dans l'optimisation de votre gestion des m², des occupants et des objets.\xa0"", ""\u200bQue vous soyez DET, acteur du Facility Management, DRH ou encore analyste financier, Surfy dispose de fonctionnalités qui servent vos activités avec efficacité et délivre des plans et des données d'exploitation fiables.\xa0"", ""\u200bSurfy est une solution digitale soluble dans votre culture d'entreprise, \xa0pour permettre l'échange et la communication et une gestion autonome en toute sérénité."", '', 'Ajoutée le : 11 septembre 2019']",surfy.pro,['https://www.linkedin.com/company/surfy/'],Société par action simplifiées
YRCASH,Finance,Gestion dématérialisée de votre trésorerie,['Bruno RENAUD BLANC-FONTENILLE '],"['Créé en 2009, YRCAM puise dans l’expérience de ses entités opérationnelles pour construire une expertise d’anticipation et d’innovation du pilotage et de l’optimisation de la trésorerie clients.', 'En gardant l’esprit pionnier et orienté qualité, YRCAM revisite en permanence les métiers de la relation financière clients.', 'Chez YRCAM, notre engagement est d’optimiser votre trésorerie en vous accompagnant avec des services personnalisés de qualité.', '', 'Ajoutée le : 11 septembre 2019']",yrcash.fr,['https://www.linkedin.com/company/groupeyrcam/'],SA par action simplifiée à associé unique
NAHIBU,"Santé, Biotech, Chimie - Diagnostique, Analyse",Commercialise un kit d'analyse de votre microbiote intestinal,['Pierre CRESSARD '],"[""Grâce à une analyse de votre microbiote vous découvrirez des conseils adaptés à vos besoins afin d'optimiser par l’alimentation votre santé et votre bien-être."", 'Vos résultats apparaissent sous forme de scores en pourcentage par rapport à la cohorte Nahibu (ensemble des utilisateurs).', 'Les explications de vos résultats ainsi que les conseils alimentaires associés vous permettront de mieux comprendre vos analyses et de pouvoir agir sur votre santé.', '', 'Ajoutée le : 11 septembre 2019']",nahibu.com,['https://www.linkedin.com/company/nahibu'],Société par action simplifiées
JERONIMOOOO,"Emploi, Job",Permettre aux indépendants de mettre en place un réseau efficient pour leur activité professionnelle,['Jérôme  Sevestre'],"['Être indépendant n’a jamais voulu dire être dans la panade, ne plus dormir, être perdu, ne pas savoir comment sécuriser son acquisition client et surtout se retrouver seul du jour au lendemain alors que l’idée de base est bien souvent d’être libre de ses mouvements émotionnels et financiers.', 'La solitude de l’indépendant/l’entrepreneur, n’est pas un mythe, elle touche 87% de cette population qui a le courage de se lancer dans le vide bien souvent sans parachute doré, juste pour être en phase avec elle-même.', 'C’est pourquoi, nous avons décidé de lancer Jeronimoooo !', 'Jeronimoooo se veut être la 1ère action concrète et complète que peut mettre en place un indépendant pour créer du lien avec d’autres personnes partageant un mindset similaire et mettre en place un réseau efficient pour son activité professionnelle.', 'En plus de créer du lien, Jeronimoooo vous permet d’avoir accès à un ensemble de services essentiel au quotidien à des tarifs négociés auprès de partenaires réactifs et dignes de confiance.', '', 'Ajoutée le : 11 septembre 2019']",jeronimoooo.co,['https://www.linkedin.com/company/jeronimoooo/'],Pays de la Loire
HELLOHOME,"Immobilier, BTP, Architecture - Immobilier","Met en relation des personnes cherchant un bien à louer ou acheter, et les professionnels de l'immobilier",['Etienne LONGEAUD '],"['En moins de 3 minutes, vous décrivez ce que vous recherchez.', ""Nous partageons votre recherche avec toutes les agences immobilières et professionnels susceptibles d'avoir un bien qui correspond"", 'Nous vous mettons en contact ou vous transmettons les meilleurs opportunités correspondant à votre recherche.', 'Vous choisissez lesquelles vous intéressent', 'Echangez avec les agences et vendeurs que vous aurez sélectionnés, visitez... et trouvez votre bonheur.', '', 'Ajoutée le : 11 septembre 2019']",hellohome.fr/,['https://www.linkedin.com/company/hellohome-fr/'],Commerçant
MILVUE,"Santé, Biotech, Chimie - Accessoires médicaux",L'Intelligence Artificielle Pour La Radiologie d'Urgence,['Alexandre PARPALEIX '],"['', 'Ajoutée le : 11 septembre 2019']",milvue.com,['https://www.linkedin.com/company/18657184/'],Société par action simplifiées
CALA,"Restauration, Cuisine, Alimentation","Le premier restaurant de pâtes, où le cuisto c'est le robot",['Ylan RICHARD '],"[""Nous avons construit\xa0le premier restaurant de pâtes entièrement robotisé pour transformer la structure de coûts et l'expérience des restaurants\xa0rapides."", 'C’est la raison pour laquelle nous avons créé Cala, pour faire entrer le déjeuner dans une nouvelle ère et dans votre assiette en moins d’une minute.', 'Il faut juste une cuisine de 3m2 pour servir très rapidement 800 repas par heure cuisinés avec des ingrédients frais et biologiques.', '', 'Ajoutée le : 10 septembre 2019']",eatcala.com/,['https://www.linkedin.com/company/calaeat/'],Société par action simplifiées
URBASSIST,Services aux particuliers,Le premier assistant d’urbanisme en ligne,['Guilhem  TUFFERY'],"['Urbassist est une plateforme web (www.urbassist.fr) \xa0qui facilite et accélère l’établissement des demandes d’urbanisme telles que les déclarations préalables et les permis de construire.', 'En moins d’une heure, les utilisateurs obtiennent gratuitement les Cerfas, ces formulaires administratifs réglementés, correspondant aux travaux prévus.\xa0', 'Cet outil numérique permet également aux utilisateurs de dessiner leurs plans de masse en ligne, d’obtenir automatiquement les plans de coupe et de pouvoir les télécharger immédiatement au format PDF. \xa0', 'Urbassist permet ainsi de constituer en ligne le dossier préalable indispensable avant de commencer des travaux.\xa0\n\xa0', '', 'Ajoutée le : 10 septembre 2019']",urbassist.fr,['https://www.linkedin.com/company/14836091/admin/'],Société par action simplifiées
BEAUTYCAB,"Mode, Textile, Beauté - Cosmétique","Votre espace beauté où vous voulez, quand vous voulez",['Johanna STREIFF '],"['Première plateforme innovante de location éphémère d’espace de travail destinée aux professionnels de la beauté BeautyCab® met en relation :', '• des Espaces Beauty souhaitant louer leur cabine, leur fauteuil, leur espace de travail : propriétaires ou managers de salon de coiffure, institut de beauté, barbershop, bar à ongles, SPA, ...', '• et des professionnels de la beauté sous statut indépendant ou freelances! Des coiffeurs, esthéticiennes,\nbarbiers, maquilleuses, prothésistes ongulaires... cherchant à louer une cabine, fauteuil ou un espace de travail pour la journée, la semaine, le mois, voire l’année.', 'Les propriétaires d’Espaces Beauty peuvent bénéficier d’un complément de chiffre d’affaires en louant leurs espaces vacants.\xa0\nLes freelances, quant à eux, y trouvent une alternative au secteur de la beauté à domicile.\xa0', 'Avec la location « à la carte », ils s’installent à moindre frais, sans engagement, avec des démarches administratives simplifiées. Ils peuvent fixer librement les tarifs de leurs prestations et préservent ainsi leur indépendance tout en bénéficiant d’un tremplin.', 'Une relation GAGNANT-GAGNANT', '', 'Ajoutée le : 10 septembre 2019']",beautycab.fr/,['https://www.linkedin.com/company/beautycab-rentmybeautycab/'],Société par action simplifiées
FREQUENS,Transport & Logistique - Voiture,Eviter les amendes de stationnement,[],['Ajoutée le : 10 septembre 2019'],frequens.com,['https://www.linkedin.com/company/41646105'],FREQUENS
THE IDEALL,"Art, Culture, Loisirs, Sport - Sortie",Des expériences à découvrir et à offrir en lien avec vos goûts et vos envies,"['Mainou LAOUCHEZ ', 'Alexandra GUENANTIN ']","['Comment tu fais quand tu as envie de sortir, mais que tu n’as aucune idée ? Que tu dois acheter un cadeau à un proche mais que tu es en panne d’inspiration ?', 'IdeAll te permet de réaliser ou d’offrir des expériences selon les goûts, les pratiques et les envies de la personne.', ""Et oui, nous sommes la première plateforme de matching d'idées cadeaux et d'expériences ! Nous prenons en compte vos goûts et vos envies pour vous proposer les expériences idéales à vos yeux.\xa0"", 'Fondée en 2019 par deux entrepreneuses déterminées, IdeAll est un réel projet social qui met au centre les goûts de nos membres grâce à digital pour leurs permettre de vivre un moment idéal !\xa0', 'Alors ne ratez plus une seconde et faites partie de cette aventure !\xa0', '', 'Ajoutée le : 10 septembre 2019']",theideall.com,['https://www.linkedin.com/company/theideall/'],Société par action simplifiées
HEROPOLIS,Services aux entreprises - RH,Gestion des risques sécurisée,['Jean INGEA '],"['Heropolis place la Sûreté et la Sécurité au coeur des organisations à travers deux outils de qualité.', 'Au delà des offres de protection individuelles, vous planifiez et suivez en temps réel votre politique sûreté, de l’urgence à la crise.\n\nAvec Heropolis, votre organisation sait réagir et s’adapter rapidement face aux nouvelles menaces.\n\xa0', '', 'Ajoutée le : 10 septembre 2019']",heropolis.fr,['https://fr.linkedin.com/company/heropolis'],Société par action simplifiées
MIKRO,Transport & Logistique - Logistique,Service de débarras encombrants professionnels Paris & Toulouse,['Arnaud HUMBERT DROZ '],"['MIKRÔ, c’est la solution pour vous débarrasser de vos encombrants professionnels tout en leur donnant une seconde vie.\xa0', 'Vous êtes un acteur de la restauration ou du commerce de proximité, un bureau de PME ou PMI et la vie de votre entreprise nécessite parfois du changement ?', 'Au cœur des villes, il n’est pas facile de vous débarrasser des quelques m3 qui peuvent rapidement vous embarrasser.\xa0', 'Le service MIKRÔ est fait pour vous ! Il apporte une réponse clé en main, efficace et au meilleur prix : une équipe de mikrôs locaux vient vous débarrasser sur place de vos encombrants professionnels. Et même en étage !', '', 'Ajoutée le : 10 septembre 2019']",mikro-service.fr/,['https://www.linkedin.com/company/mikro-services/'],Société par action simplifiées
AIVE,SSII & NTIC - Media,Outil de personnalisation de pubs vidéo grâce à l'IA,"['Olivier REYNAUD ', 'Rudy LELLOUCHE ']","['Aive est une Startup cofondée par Olivier Reynaud (Teads) & Rudy Lellouche (Adyoulike) qui a pour mission de Révolutionner l’industrie vidéo grâce à une intelligence artificielle créative.', '', 'Ajoutée le : 10 septembre 2019']",aive.com/,['https://www.linkedin.com/company/aive-com/'],Société par action simplifiées
BLIINK,Services aux entreprises - Productivité,"Une entreprise d'intelligence visuelle, dotée d'une grande expertise en vision par ordinateur",['Siham FADILI '],"['Nous pensons sincèrement que le meilleur moyen de résoudre le monde complexe qui nous entoure est de trouver le juste équilibre entre créativité, technologie de pointe, stratégie UX et marques, afin de pouvoir proposer des annonces offrant la plus grande valeur ajoutée possible.', ""Notre technologie unique fournit une solution reliant les marques et les éditeurs afin d'améliorer l'expérience utilisateur à travers tout le contenu visuel."", '', 'Ajoutée le : 09 septembre 2019']",bliink.io/,['https://www.linkedin.com/company/bliink-io/'],Société par action simplifiées
COWLOC,Services aux entreprises - Productivité,La première communauté de Colocation entre Pros,['Christopher  Hablet'],"['Une solution pour les professionnels qui souhaite rentabilité leurs espaces de travail inoccupés.', 'Une vitrine à optimiser ? Un espace libre ? Des fauteuils vides ? \xa0', 'Cowloc propose à ses adhérents de poster leurs annonces et proposer leurs espaces à d’autres professionnels.\xa0', '', 'Ajoutée le : 09 septembre 2019']",app.cowloc.fr,['https://www.linkedin.com/showcase/cowloc'],Association déclarée
COLIVER,Transport & Logistique - Livraison,La communauté collaborative de la colivraison,['Karim TAHRI '],"['Gratuit, collaboratif, sécurisé et basé sur le principe de la colivraison, Colivrer.com vous propose une solution optimale face aux difficultés de livraison et aux frais d’expédition.', '➜ Partagez votre trajet et rentabilisez votre voyage.\n➜ Livrez votre colis en toute sérénité.', '', 'Ajoutée le : 09 septembre 2019']",colivrer.com,['https://www.linkedin.com/company/colivrer.com/'],Société par action simplifiées
