Startup,Type,Intro,Fondateurs,Description,Site,Lien Utile,Info
JE SORS AVEC BEBE,"Art, Culture, Loisirs, Sport - Sortie",Trouvez une sortie adaptée à votre enfant et vous,['Olivier  CORDIN'],"['Jesorsavecbebe s’adresse aux parents, grands-parents, aux familles et aux amis de parents de bébés de 0 à 4 ans qui souhaitent obtenir des informations concernant l’accès, l‘accueil, les services aux \xa0tous petits dans les établissements qui accueillent le public (hôtels, restaurants, centres commerciaux, \xa0musées et lieux de culture, lieux de loisir et de tourisme) afin de préparer au mieux leurs sorties et de mieux profiter de leurs moments à l’extérieur avec leur(s) enfant(s).', 'Notre credo : Etre parents ne dois pas empêcher de vivre, être bébé ne dois pas empêcher de sortir !', '', 'Ajoutée le : 19 septembre 2019']",jesorsavecbebe.com,['https://www.linkedin.com/company/jesorsavecbebe.com'],81533938700012
JEMANGEFRANCAIS,"Restauration, Cuisine, Alimentation - Services","Epicerie fine en ligne, Coffrets gourmands",['Eric CAÏROU'],"['jemangefrancais.com à travers la sélection de ses produits et de ses partenaires s’est donné pour mission en tant que distributeur de défendre la Gastronomie Française, plus précisément le repas gastronomique français, qui rappelons le est inscrit au patrimoine immatériel de l’UNESCO, .', 'Nous avons un vrai savoir faire reconnu par la planète entière, donc ne nous privons pas de le clamer haut et fort et défendons nos agriculteurs, artisans et PME des métiers de bouche sans qui le repas gastronomique français perdrait de son intérêt...', 'Nous vous proposons donc de retrouver en ligne sur jemangefrancais.com des produits en relation avec :', 'l’épicerie salée\nl’épicerie sucrée\nles boissons\nla charcuterie\nles produits frais\nl’art de la table à la française\nles coffrets gourmands et coffrets cadeaux', 'Vous pouvez commander en ligne toute une gamme de produits que nous livrons partout en France et en Europe sous des délais qui varient de 48 à 72 h', '', 'Ajoutée le : 19 septembre 2019']",jemangefrancais.com,['https://twitter.com/@jemangefrancais'],Société par action simplifiées
PABLO,"Art, Culture, Loisirs, Sport",L'appli des Expos,['Florence GUIONNEAU JOIE '],"['Envie d’expo ?\nPablo est l’appli qu’il vous faut.', 'Découvrez toutes les expos sur Paris et laissez-vous inspirer : achetez directement votre billet sur l’application, et partez vivre une expérience artistique !', 'Comment ? Rien de plus simple :', '· laissez-vous tenter par la sélection de Pablo\n· dénichez toutes les expos des musées, galeries et autres lieux culturels à proximité\n· retrouvez les informations détaillées liées à l’expo (dates et horaires)\n· réservez votre billet rapidement dans l’application', 'Les points forts de Pablo :', '· cherchez des expositions suivant vos préférences artistiques\n· faites confiance au commentaire de Pablo pour faire votre choix\n· réservez votre coupe-file directement sur l’app, au meilleur tarif\n· utilisez votre application de navigation favorite pour vous y rendre (Uber, Google Maps)\n· sauvegardez vos expos favorites\n\xa0', '', 'Ajoutée le : 19 septembre 2019']",pablo-app.com/fr,['https://www.linkedin.com/company/pablo-app/'],SA par action simplifiée à associé unique
TAXYMATCH,Transport & Logistique,Application de partage de taxi ou VTC collectif,['Jean ROUGAGNOU '],"['TaxyMatch permet aux passagers de se retrouver avant la prise en charge par le taxi ou le VTC.', 'Entrez dans notre appli, recherchez ou indiquez votre trajet.', 'Nous vous mettons en contact avec d’autres passagers qui ont un trajet similaire.', 'C’est équivalent à un site de covoiturage mais personne n’a de voiture, seuls des passagères et passagers sont mis en contact.', '', 'Ajoutée le : 19 septembre 2019']",taxymatch.com,['https://www.linkedin.com/in/taxymatch-france-47a804167/'],SA par action simplifiée à associé unique
BOUGE TON KID,"SSII & NTIC - Curation web, Moteur de recherche","Permet aux familles de trouver en instantanée, activités, évènements et sorties",['Lou Dunker'],"['BougeTonKid est ainsi et avant tout une solution pratique, sécurisée et immédiate pour trouver activités et évènements « Famille - Enfants » selon 3 critères :', 'Géoloc - Âge des enfants - Envies et préférences (météo etc…)', 'Mais aussi pour s’organiser des sorties entre familles, toujours selon le même schéma (Géoloc - Âge des enfants - Envies).', 'Ex : un pique-nique entre familles ? Une sortie karting entre papas et enfants de 10-14 ans ? Un running poussette entre mamans ? Un atelier créatif grands-parents et petits-enfants ? etc… c’est ce qu’on veut en réalité !', 'Face à cela, on peut trouver tous professionnels, associations, lieux publics etc… tout ou partie orientés « familles - enfants ».', 'Géolocalisés, ils jouissent tous d’une page propre avec texte, image, coordonnées complètes et horaires d’ouverture.', ""Ils sont répartis selon un tri par catégories que nous avons créé (ex. cours de cuisine), ou de plus grandes rubriques (ex. « Activités d'intérieur ») et sont ainsi accessibles en 3 clics, d’une clientèle de résidence comme de passage (pour leur activité à l’année ou leurs évènements temporaires)."", 'Finies les pannes d’idées de sorties ! Finies les longueurs de temps de recherches ! Finis les week-end ratés en cas d’imprévus !\nDu moins c’est notre objectif… :-)', 'Il faut ainsi dissocier sur BougeTonKid les « activités à l’année » (Activités familiales) = Ex. un club de foot est club de foot à l’année,\n...des « activités ponctuelles » (Évènements & sorties) = Ex. ce même club de foot organise samedi une journée portes ouvertes.', 'Cerise sur le gâteau : les évènements sont visibles dans la partie « agenda » (évènements & sorties), et aussi envoyés chaque semaine dans la newsletter, que les utilisateurs peuvent affiner selon la géoloc (à la maison / en vacances…), et l’âge de leurs enfants.', '', 'Ajoutée le : 19 septembre 2019']",bougetonkid.fr/,['https://www.linkedin.com/company/bougetonkid/'],Association déclarée
MY DUAL PROJECT,"Education, Apprentissage",Permet aux sportifs de poursuivre à la fois une carrière sportive et une formation académique,['Fernanda  Arreola'],"[""Nous traitons l'éducation comme un voyage de toute une vie !"", ""Nous misons sur la passion, la motivation et l'énergie d'un individu pour\xa0fournir des connaissances en affaires et des compétences entrepreneuriales"", '\xa0\xa0- par le biais de cours de niveau master accrédités -', 'qui vous permettent de devenir un entrepreneur de votre propre vie et de réaliser une reconversion de carrière.', '', 'Ajoutée le : 18 septembre 2019']",mydualproject.com,['https://www.linkedin.com/company/my-dual-project/'],Société par action simplifiées
LES SAVEURS D ANGELUS,"Restauration, Cuisine, Alimentation - Produits frais",Livraison de fruits au bureau,['Louis-Marie  Renard'],"['Les Saveurs d’Angélus est une jeune entreprise de livraison de délicieux fruits au bureau en Ile de France.', 'Consciente de la nécessité de plus en plus évidente de se nourrir de produits sains de nos terroirs, consciente de l’importance de suivre une alimentation saine, riche et variée, Les Saveurs d’Angélus propose des produits d’une grande fraîcheur.', 'Chaque produit est savoureusement étudié et sélectionné - origine, mode de production, qualité, fraîcheur - avant d’être proposé à la clientèle afin de garantir excellence et satisfaction de nos clients.', 'De plus, dans le souci de favoriser l’économie locale et de privilégier les circuits courts, l’entreprise a créé des partenariats avec les artisans et producteurs locaux et régionaux, habitant pour beaucoup en Ile-de-France.', 'Née en 2017, Les Saveurs d’Angélus travaille déjà avec plusieurs entreprises soucieuses du bien-être de leurs salariés.', ""Celles-ci se réjouissent de proposer à leurs équipes une alternative aux repas trop rapides et manquant d'équilibre, peu recommandés par les nutritionnistes, les directives de santé publique et ... le bon sens."", 'Au-delà du souci du « se nourrir sainement », Les Saveurs d’Angélus offre la possibilité de découvrir et/ou redécouvrir la richesse de nos terroirs : des produits simples au goût authentique, rassasiants et dynamisants !', '', 'Ajoutée le : 18 septembre 2019']",saveursdangelus.com,['https://www.linkedin.com/company/saveurs-dangelus/'],Société par action simplifiées
MONART,"Art, Culture, Loisirs, Sport",La première plateforme au monde blockchain dédiée à toutes les formes d'art,"[""Malo GIROD DE L'AIN ""]","['Monart la communauté artistique et le marché international innovant :', ""Monart permet de découvrir, discuter, apprécier et acheter de superbes œuvres d'artistes du monde entier."", ""Monart est également le nouveau marché de l'art permettant d'acheter de superbes œuvres ou des actions en ligne, lors d'enchères ou d'événements\xa0et de profiter de la croissance du marché de l'art."", 'Monart organise une importante promotion d’artistes en ligne et hors ligne et contribue à la création d’œuvres d’art novatrices et perturbatrices grâce à l’aide du Fonds d’accélération artistique Monart.', '', 'Ajoutée le : 18 septembre 2019']",monart.art/,['http://www.linkedin.com/company/my-monart'],Société par action simplifiées
REA,"Immobilier, BTP, Architecture - BTP, Architecture",Organisez vos travaux et gagnez du temps,"['Maxence HARM ', 'Zélia HARM ']","[""Réa. est la première application de gestion de travaux aussi complète et qui s'adresse avant tout aux petites structures de conception comme aux entreprises."", 'Inspirée de la théorie du BIM, elle offre dès le DCE une vision globale et organisée de votre projet de construction, de rénovation ou de décoration et vous suit tout au long de vos petits et de vos grands travaux.', 'Elle s’adapte à tous les utilisateurs grâce à ses nombreux outils interactifs pour permettre d’économiser du temps et de l’argent.', '', 'Ajoutée le : 18 septembre 2019']",rea-app.fr,['https://www.linkedin.com/company/rea-app/'],Société par action simplifiées
MY CYBER ROYAUME,"Electronique & Composants - Réalité Augmentée, Réalité Virtuelle",Concepteur de programmes innovants en réalité virtuelle,['Dimitri COLLET '],"['My Cyber Royaume conçoit des outils technologiques en réalité virtuelle en s’alliant avec des grands professeurs, chercheurs, médecins et thérapeutes.', 'Notre force: une équipe pluridisciplinaire dédiée à nos projets. Nous les réalisons sur mesure pour nos clients en plus des gammes dédiées à la stimulation, au soin et à la santé des utilisateurs.', 'My Cyber Royaume révolutionne la pratique thérapeutique en encourageant la prévention, le soin et en stimulant la participation active des patients, atteints de troubles cogntifs ou moteurs légers tout en les émerveillant.', '', 'Ajoutée le : 18 septembre 2019']",mycyberroyaume.com/,['https://www.linkedin.com/company/my-cyber-royaume/'],Société par action simplifiées
BOROBO,"Electronique & Composants - Drone, Robotique",Le 1er chariot de course robotisé pour transporter des charges lourdes,['Patrick CHANUDET '],"['La société BOROBO a été créée en novembre 2018 dans le but de mettre au point le premier robot de transport personne autonome et tout-terrain pour le grand public.', 'L’ambition de l’entreprise est de concevoir et développer des produits grand public de grande qualité qui offre des performances remarquables. Cette ambition est sous-tendue par un investissement important en R&D et par une équipe d’ingénieurs passionnés (électronique, informatique embarquée, robotique, mécatronique).', 'Nos robots visent à soulager les femmes et les hommes de tâches fastidieuses, pénibles, ingrates avec des capacités cognitives avancées.', '', 'Ajoutée le : 18 septembre 2019']",borobo.fr,['https://www.linkedin.com/company/borobo/'],SA par action simplifiée à associé unique
MAEL,"Santé, Biotech, Chimie - Services",Le réseau de psychologues disponibles par chat à l’écoute de vos collaborateurs,['Malo  Lebrin'],"['La 1ère action concrète pour prévenir les risques d’hyperstress et de burnout.', 'UN MAEL DÉDIÉ ET RÉACTIF\nÀ chaque mise en place, un Mael viendra vous rencontrer pour discuter et vous orienter dans la mise en place et le suivi de l’outil de chat.', 'L’OUTIL DE CHAT OPÉRATIONNEL\nChaque collaborateur bénéficie d’un accès privé sur son poste de travail ou son mobile. Chaque accès est anonyme et confidentiel.', 'SUIVI ET PRÉCONISATION\nNotre mindset est de vous accompagner, de trouver des réponses adaptées à vos demandes et de vous donner les outils pour améliorer le bien-être de vos collaborateurs.', '', 'Ajoutée le : 18 septembre 2019']",mael.co/,['https://www.linkedin.com/company/28471434/'],MAEL
REUNIO,Services aux entreprises - Productivité,Outil d'organisation réunion pour professionnel et entreprise,"['Patrice THYRION ', 'Sebastien PONS ']","['Réunio est édité par InnovApp, jeune startup ""made in France"" née d\'une volontée commune de ses fondateurs de contribuer à la transformation digitale des entreprises.', 'Soutenus par le programme French Tech de la BPI, nous souhaitons apporter des solutions digitales aux problèmes d’organisation rencontrés par les entreprises.', ""Nos applications se veulent ergonomiques, donnant la priorité à l'UX design et sachant s'interfacer avec les divers environnements de travail pour simplifier la logistique organisationnelle."", '', 'Ajoutée le : 18 septembre 2019']",reunio.fr,['https://www.linkedin.com/showcase/reunio-france'],Société par action simplifiées
EASYCRYO,"Santé, Biotech, Chimie - Health Tech",Fabricant d'appareils de cryothérapie,['Stanislas CERVILLA'],"['La société MKS PARIS est une structure spécialisée dans la cryothérapie localisée\xa0depuis fin 2009.', 'Suite au rachat de la société Novantis France en décembre 2009 qui concevait et commercialisait un produit de cryothérapie à gaz, l’activité de notre structure s’est développée dans le domaine du froid.', 'Nous produisons la gamme «\xa0easycryo\xa0» et commercialisons à notre nom et à nos marques des produits de cryothérapie à air pulsé «\xa0easyair\xa0» depuis 2011 et de compression glacée «\xa0easycry’eau\xa0» depuis fin 2014.', 'Nous offrons donc la possibilité d’utiliser le froid par le gaz, par l’air ou par l’eau dans la kinésithérapie sportive et généraliste.', '', 'Ajoutée le : 17 septembre 2019']",easycryo.fr/fr/,['https://www.linkedin.com/company/mks-paris/'],Société par action simplifiées
PRUNE,"Restauration, Cuisine, Alimentation - Services",La plus grande table bistronomique de France,"['Cyril ROMANET ', 'Charlotte THIENPONT ']","['Une cuisine bistrot, prête à être dégustée dans le confort du chez soi et cela partout en France.', 'Des plats doucement mijotés puis servis dans des bocaux en verre, afin de préserver au mieux leurs saveurs, que l’on déguste sur le moment ou dans les 10 jours après réception.', '', 'Ajoutée le : 17 septembre 2019']",prune.co,['https://www.linkedin.com/company/prune-co/'],Société par action simplifiées
LIBU,"Electronique & Composants - LED, Eclairage",Un éclairage bien-être pour votre entreprise,['Manon LOUSTAU '],"['Le luminaire Libu est une dalle à LED qui s’insère dans vos faux plafonds.', 'Simple d’installation et d’utilisation, il propose une lumière d’une qualité optique optimale à un prix abordable.', 'La technologie de lumière circadienne utilisée contribue au bien-être des salariés via la régulation de l’horloge biologique.', '', 'Ajoutée le : 17 septembre 2019']",libu.fr,['https://www.linkedin.com/company/libu'],Société par action simplifiées
ENDRO,"Mode, Textile, Beauté - Cosmétique",Déodorant naturel bio,"['Boris  Le Goffic', 'Marion  Le Goualher']","[""Endro, un déodorant naturel, bio et vraiment efficace avec seulement 4 ingrédients? C'est possible, on l'a fait!"", ""Terminé les composants nocifs et le plastique, notre gamme de déodorants est composé d'huile de coco, d'amidon de maïs, de bicarbonate de soude et de cire de carnauba , bref une alternative naturelle, dans un bocal en verre recyclable à l'infini!"", ""Sentir bon des aisselles c'est important, en prenant soin de sa santé et de l'environnement c'est encore mieux!"", '', 'Ajoutée le : 17 septembre 2019']",endro-cosmetiques.com/,['https://www.facebook.com/Endro-308485266751720/'],Profession libérale
LES MINI MONDES,"Jeux, Jouets","Des jouets en plastique recyclé, fabriqués en France",['Quentin  Ory'],"[""Les Mini Mondes ce n'est pas juste une marque de jouet, c’est tout un univers !"", 'L’histoire d’une famille qui part faire le tour du monde en VAN…\xa0', 'Ce sont des jouets fun et ludiques qui favorisent l’éveil, mais c’est aussi du contenu éducatif pour les enfants et pour les parents.', 'Côté responsable c’est simple, on a tout fait différemment : plastique recyclé, fabrication française, collecte des jouets en fin de vie, et même le 1% voyage !', '', 'Ajoutée le : 17 septembre 2019']",lesminimondes.fr/,['https://www.linkedin.com/company/les-mini-mondes/'],Société par action simplifiées
L INTENDANCE,"Cleantech, Energie - Recyclage","Consigne simplifiée, 100% zéro-plastique","['Meryem BENMOUAZ ', 'Noélie  Demaegdt']","[""On a créé L’intendance pour vivre au quotidien en améliorant notre impact sur l'environnement."", 'On pense que pour être durable, la consommation du futur est plus locale, plus ingénieuse. \xa0', ""Qu'elle fait coexister les recettes de grand-mères à base de produits naturels et les innovations scientifiques. Que les messages marketing superflus et emballages en plastique n’y ont plus leur place."", 'Vous êtes donc au bon endroit si vous cherchez un repère pour faire vos courses :', '- radicalement sans plastique, avec des emballages réduits à leur minimum et un système de consigne simplifié,\n- en toute transparence sur l’origine et la qualité des produits,\n- en choisissant vos quantités pour ne rien gaspiller, ni vous encombrer inutilement.', 'Et cela sans se ruiner, parce que réduire nos emballages ne devrait pas coûter plus cher.', ""Nos produits sont sélectionnés avec le plus grand soin et nous tirons notre fierté des relations que nous tissons avec les artisans et producteurs partenaires de L'intendance, qui sont tous très sympas."", 'Chaque année dans le monde, ce sont 300 millions de tonnes de plastique qui sont produites dont ⅓ pour les emballages. Sans attendre que les mesures dissuasives soient mises en place, nous vous proposons une solution gourmande et alternative pour amorcer la transition et réduire notre impact environnemental !', ""Soyons globalement cohérents, et concentrons-nous sur l'essentiel."", '', 'Ajoutée le : 17 septembre 2019']",lintendance.co,['https://www.linkedin.com/company/lintendance/'],SA par action simplifiée à associé unique
NEXT STATION,"Emploi, Job",Plateforme de recrutement international,['Maria RODRIGUEZ MONTERO '],"['Postule directement à des centaines de jobs internationaux qui matchent tes compétences, intérêts et priorités.', ""Gagne du temps en recevant directement des demandes d'entretien dans ta boite mail."", ""Fini la recherche d'offres, candidatures et lettres de motivation ! Consacre juste ton temps à découvrir ta prochaine destination et à faire ta valise. On s'occupe du reste."", '', 'Ajoutée le : 17 septembre 2019']",nextstation.com,['https://www.linkedin.com/company/wearenextstation/about/'],Société par action simplifiées
HELLO NEO,"Mode, Textile, Beauté - Accessoires",La plateforme dédiée au mode de vie zéro déchet,"['Baptiste EMY ', 'Debora  Attal']","['Avec une certaine exigence, nous sélectionnons le meilleur de la fabrication tricolore et surtout zéro déchet.', 'Nous vous invitons à partir à la rencontre des artisans, par le biais de notre journal afin de vous inspirer, prendre le temps et consommer différemment.', '', 'Ajoutée le : 16 septembre 2019']",helloneo.fr/,['https://www.linkedin.com/company/hello-neo/'],Commerçant
FRANCE TOMBALE,Services aux particuliers - Services à domicile,Articles funéraires et monuments funéraires traditionnels,['Jeremy  Dols'],"['La société France Tombale propose partout en France des articles funéraires et des monuments funéraires traditionnels mais aussi innovants et notamment une gamme de monuments à monter soi-même.', 'La raison d’être de France Tombale est de proposer le prix juste en toute transparence et en valorisant le granit français et la fabrication française.', '', 'Ajoutée le : 16 septembre 2019']",france-tombale.fr,['https://www.linkedin.com/company/hello-neo/'],Société par action simplifiées
ERMIUM THERAPEUTICS,"Santé, Biotech, Chimie - Diagnostique, Analyse",Développer des thérapies innovantes pour les maladies auto-immunes,['Joel CROUZET '],"[""Ermium Therapeutics est une société de biotechnologie développant des thérapies innovantes pour les maladies auto-immunes, basée sur une découverte décisive montrant que le CXCR4 est un régulateur de l'inflammation."", 'Ermium Therapeutics a été fondée en juin 2019 par Jean-Philippe HERBEUVAL, Kurma Partners, Idinvest Partners, Domain Therapeutics et Erganeo.', ""La société est basée à Paris et a signé un accord de licence exclusive mondiale sur la propriété intellectuelle du CNRS et de l'Université Paris Descartes (France) dans le cadre d'un accord avec Erganeo, qui a soutenu la maturation du projet en milieu universitaire."", ""De plus, Ermium Therapeutics a récemment remporté le prix d'innovation i-Lab 2019 du ministère de la Recherche et de l'Enseignement supérieur."", '', 'Ajoutée le : 16 septembre 2019']",ermium.com/,['https://www.linkedin.com/company/hello-neo/'],Société par action simplifiées
WATTSPLAN,"Art, Culture, Loisirs, Sport - Sport",La première plateforme dédiée au sport et au bien-être,['Arnaud MORLOT '],"['Wattsplan facilite et encourage la pratique d’activités sportives et de bien-être.\xa0', '• Proposez/participez à des plans (évènements, services...), plus de 300 activités sportives/bien-être référencées. Chaque plan publié s’affiche automatiquement sur la page d’accueil des membres intéressés par les mêmes activités. • Trouvez des partenaires d’entraînement, des professionnels (coachs, praticiens…) à proximité.\xa0', '• 300 000 équipements sportifs et 3 000 centres de bien-être géolocalisés.\xa0', '• Restez en forme avec le blog Wattsplan rempli de conseils et d’astuces !\xa0', 'Et ce n’est pas tout ! Sur Wattsplan, vous gagnez des Watts en publiant ou en participant à des plans. Ces Watts donnent accès à des avantages, réductions, cadeaux, proposés par nos partenaires.\xa0', 'Comment ? Rien de plus simple, une minute pour vous inscrire, 1 clic pour participer à une activité !\xa0', ""Vous précisez dans votre profil les activités et la zone géographique qui vous intéressent. Votre page d'accueil vous affiche maintenant automatiquement tous les plans répondant à vos critères. Un plan vous tente ? Cliquez sur « Participer » pour rejoindre la liste de participants !\xa0"", 'Aucun plan ne répond à vos attentes ? Publiez le vôtre, il sera automatiquement diffusé sur la page d’accueil des membres intéressés par l’activité que vous proposez.\xa0', 'Pour convertir vos Watts gagnés, cliquez sur le menu « Offres », puis parcourez la liste des offres de nos partenaires.', 'Laissez-vous guider en consultant les pages « Aide » et « Comment ça marche ? » pour plus d’explications.\xa0', '', 'Ajoutée le : 16 septembre 2019']",wattsplan.com/,['https://www.linkedin.com/company/wattsplan'],Société par action simplifiées
FIFTY,Services aux entreprises - Productivité,Aide les collaborateurs à passer des intentions théoriques à la pratique concrète,['Alexia CORDIER '],"['Fifty aide les collaborateurs à passer des intentions théoriques à la pratique concrète.', ""Notre plateforme génère des actions personnalisées à accomplir en situation de travail, sur l'ensemble des thèmes du savoir-faire et du savoir-être."", ""Nous utilisons la méthode du Nudge, du prix Nobel d'Economie 2017, que nous associons à l'I.A.\xa0"", 'Fifty est une AFEST (action de formation en situation de travail) selon la nouvelle loi Avenir, déployable à grande échelle grâce au digital.', '- Accéléré par Orange et WILCO\n- Soutenu par la BPI et la Région Île-de-France\n- Sélectionné dans les 100 start-ups où investir en 2019 de Challenges\n- Lauréat des concours Grandes Ecoles au Féminin, She Loves Tech France et IE-Club Global 60.\xa0', '', 'Ajoutée le : 16 septembre 2019']",,['https://www.linkedin.com/company/thefiftyapp/'],SA par action simplifiée à associé unique
